{
  "format": "obj",
  "layers": {
    "walls": {
      "name": "walls",
      "visible": true
    },
    "roof": {
      "name": "roof",
      "visible": true
    },
    "door": {
      "name": "door",
      "visible": true
    }
  },
  "materials": {
    "default": {
      "name": "default",
      "color": 11844804
    },
    "plaster": {
      "name": "plaster",
      "color": 15079755
    },
    "tiles": {
      "name": "tiles",
      "color": 3978315
    },
    "wood": {
      "name": "wood",
      "color": 4416472
    }
  },
  "meshes": [
    {
      "name": "House",
      "layer": "walls",
      "material": "plaster",
      "positions": [
        0, 0, 0, 8, 0, 0, 8, 0, 3, 0, 0, 0, 8, 0, 3, 0, 0, 3, 8, 0, 0, 8, 6, 0, 8, 6, 3, 8, 0, 0, 8,
        6, 3, 8, 0, 3, 8, 6, 0, 0, 6, 0, 0, 6, 3, 8, 6, 0, 0, 6, 3, 8, 6, 3, 0, 6, 0, 0, 0, 0, 0, 0,
        3, 0, 6, 0, 0, 0, 3, 0, 6, 3, 0, 0, 0, 0, 6, 0, 8, 6, 0, 0, 0, 0, 8, 6, 0, 8, 0, 0
      ],
      "normals": [
        0, -1, 0, 0, -1, 0, 0, -1, 0, 0, -1, 0, 0, -1, 0, 0, -1, 0, 1, 0, 0, 1, 0, 0, 1, 0, 0, 1, 0,
        0, 1, 0, 0, 1, 0, 0, 0, 1, 0, 0, 1, 0, 0, 1, 0, 0, 1, 0, 0, 1, 0, 0, 1, 0, -1, 0, 0, -1, 0,
        0, -1, 0, 0, -1, 0, 0, -1, 0, 0, -1, 0, 0, 0, 0, -1, 0, 0, -1, 0, 0, -1, 0, 0, -1, 0, 0, -1,
        0, 0, -1
      ]
    },
    {
      "name": "House",
      "layer": "roof",
      "material": "tiles",
      "positions": [
        0, 0, 3, 8, 0, 3, 8, 3, 5, 0, 0, 3, 8, 3, 5, 0, 3, 5, 8, 6, 3, 0, 6, 3, 0, 3, 5, 8, 6, 3, 0,
        3, 5, 8, 3, 5, 0, 0, 3, 0, 3, 5, 0, 6, 3, 8, 0, 3, 8, 6, 3, 8, 3, 5
      ],
      "normals": [
        0, -0.5547001957893372, 0.8320503234863281, 0, -0.5547001957893372, 0.8320503234863281, 0,
        -0.5547001957893372, 0.8320503234863281, 0, -0.5547001957893372, 0.8320503234863281, 0,
        -0.5547001957893372, 0.8320503234863281, 0, -0.5547001957893372, 0.8320503234863281, 0,
        0.5547001957893372, 0.8320503234863281, 0, 0.5547001957893372, 0.8320503234863281, 0,
        0.5547001957893372, 0.8320503234863281, 0, 0.5547001957893372, 0.8320503234863281, 0,
        0.5547001957893372, 0.8320503234863281, 0, 0.5547001957893372, 0.8320503234863281, -1, 0, 0,
        -1, 0, 0, -1, 0, 0, 1, 0, 0, 1, 0, 0, 1, 0, 0
      ]
    },
    {
      "name": "House",
      "layer": "door",
      "material": "wood",
      "positions": [
        3.5, -0.05000000074505806, 0, 4.5, -0.05000000074505806, 0, 4.5, -0.05000000074505806,
        2.0999999046325684, 3.5, -0.05000000074505806, 0, 4.5, -0.05000000074505806,
        2.0999999046325684, 3.5, -0.05000000074505806, 2.0999999046325684
      ],
      "normals": [0, -1, 0, 0, -1, 0, 0, -1, 0, 0, -1, 0, 0, -1, 0, 0, -1, 0]
    }
  ],
  "bounds": {
    "minX": 0,
    "minY": -0.05000000074505806,
    "minZ": 0,
    "maxX": 8,
    "maxY": 6,
    "maxZ": 5
  },
  "unsupported": {
    "mtllib": 1
  },
  "metadata": {}
}
